{
  "version": "v2.0.4",
  "owner": "uDOS-core",
  "schema": "schemas/script-document-contract.schema.json",
  "summary": "Canonical script document contract for the uSCRIPT format. Defines the structure of executable markdown documents (-script.md). The Core runtime parses and dispatches ucode blocks; the TypeScript runtime renders story and presentation blocks.",
  "file_suffix": "-script.md",
  "frontmatter_fields": {
    "required": ["id", "type", "version", "runtime"],
    "optional": ["entry", "permissions"]
  },
  "type_value": "script",
  "version_value": 2,
  "runtime_values": ["tui", "web"],
  "permission_values": ["read", "write", "draw", "workflow", "network"],
  "block_types": {
    "ucode": "Executable uCode commands dispatched by the Core runtime",
    "story": "UI workflow and interactive presentation blocks rendered by TypeScript",
    "asset": "Reusable renderable components (ASCII art, media references)"
  },
  "execution_surfaces": {
    "tui_go": {
      "entry": "RUN <script.md> or SCRIPT RUN <id>",
      "flow": [
        "Core parses frontmatter and declares permissions",
        "Markdown body scanned for executable blocks",
        "uCode blocks dispatched via ucode-verb-contract",
        "Results rendered in TUI"
      ]
    },
    "web_typescript": {
      "flow": [
        "TypeScript loads markdown document",
        "Story blocks rendered as interactive UI components",
        "Outputs bound to UI state",
        "Scenes and transitions animated"
      ]
    }
  },
  "owners": {
    "contract": "uDOS-core",
    "frontmatter_parsing": "uDOS-core runtime",
    "ucode_dispatch": "uDOS-core runtime",
    "story_rendering": "uDOS-wizard",
    "presentation_theming": "uDOS-themes",
    "authoring": "any repo — follow shared format"
  }
}
